{
  "schema": "cf-publications/v3",
  "source_repo": "alexmartinevski/CF-Dependence-Public",
  "curated_on": "2026-10-16",
  "editorial_policy": {
    "source": "Claims summarized from published manuscript snapshots, not independently re-proved",
    "latest_reconciliation": "Keep source DOI fixed until highlights are checked against a newer public version",
    "scope": "Proved results and explicit qualifications; no open conjectures as proven claims"
  },
  "scholarly_verified_scope": "Approved Zenodo abstracts and PDF checksums, no internal claims",
  "papers": {
    "P01": {
      "identity": {
        "title": "A sharp universal profile for multivariate characteristic-function factorization",
        "area": "extremal",
        "topics": [
          "Characteristic functions",
          "Sharp inequalities",
          "Extremal probability"
        ],
        "keywords": [
          "Characteristic-function factorization",
          "Sharp universal dependence bound",
          "Extremal probability",
          "Prescribed mean moduli",
          "Equality cases",
          "Chebyshev polynomials",
          "Continuous dimension profile",
          "Strict concavity",
          "Gamma distributions",
          "Fourier dependence"
        ],
        "catalogue_title": "A Sharp Universal Profile for Multivariate Characteristic-Function Factorization"
      },
      "science": {
        "summary": {
          "en": "Exact dependence profiles for prescribed mean moduli, all complex extremizers and sharp constants C_d increasing to 2.",
          "ru": "Точный профиль зависимости при заданных модулях средних, все комплексные экстремали и константы C_d, возрастающие к 2."
        },
        "abstract_html": "<p>For complex random variables <span class=\"math inline\">\\(Z_1,\\ldots,Z_d\\)</span> with <span class=\"math inline\">\\(|Z_j|\\le1\\)</span> and prescribed mean moduli <span class=\"math inline\">\\(r_j=|\\mathbb E Z_j|\\)</span>, we determine the exact supremum of the product-factorization defect <span class=\"math inline\">\\(|\\mathbb E\\prod_jZ_j-\\prod_j\\mathbb E Z_j|\\)</span>. Writing <span class=\"math inline\">\\(R=\\prod_jr_j\\)</span> and <span class=\"math inline\">\\(S=\\sum_j\\arccos r_j\\)</span>, the answer is <span class=\"math inline\">\\(\\mathcal C_d(r)=R-\\cos(\\min\\{S,\\pi\\})\\)</span>. We give explicit attaining couplings, and in integer dimensions classify all extremizers through a single common symmetric sign and coordinate phases.</p>\n<p>Maximizing over the mean moduli yields the sharp universal characteristic-function bound <span class=\"math inline\">\\(C_d=\\max_{0\\le\\theta\\le\\pi/d}(\\cos^d\\theta-\\cos(d\\theta))=\\|T_d-x^d\\|_{\\infty}\\)</span>, including <span class=\"math inline\">\\(C_3=2/\\sqrt3\\)</span>, <span class=\"math inline\">\\(C_4=9/7\\)</span>, and <span class=\"math inline\">\\(C_d\\uparrow2\\)</span>. The continuous extension <span class=\"math inline\">\\(C(p)\\)</span> has a unique nondegenerate optimizer for <span class=\"math inline\">\\(p&gt;2\\)</span> and exactly one inflection point in <span class=\"math inline\">\\((2,3)\\)</span>; consequently the integer sequence is strictly concave. We also derive quantitative approximation and endpoint asymptotics, a Gamma-law interpretation, and a comparison with the real-valued case. The contribution is the sharp profile and extremal structure, not the introduction of a previously unknown dependence statistic.</p>",
        "results": [
          {
            "en": "The exact factorization-defect profile is R − cos(min{∑ arccos rⱼ, π}) for prescribed mean moduli rⱼ, with R=∏rⱼ.",
            "ru": "При заданных модулях средних rⱼ точный профиль дефекта равен R − cos(min{∑ arccos rⱼ, π}), где R=∏rⱼ.",
            "evidence": "thm:profile"
          },
          {
            "en": "The universal sharp constant is C_d=max₀≤θ≤π/d(cosᵈθ−cos(dθ)); in particular C₃=2/√3 and C₄=9/7, attained by a common fair sign.",
            "ru": "Универсальная точная константа C_d=max₀≤θ≤π/d(cosᵈθ−cos(dθ)); в частности C₃=2/√3, C₄=9/7. Экстремаль реализует общий симметричный знак.",
            "evidence": "thm:main"
          },
          {
            "en": "The constants C_d rise strictly and concavely to 2; their maximizing angles are unique.",
            "ru": "Константы C_d строго и вогнуто возрастают к 2, а максимизирующие углы единственны.",
            "evidence": "cor:discrete"
          }
        ],
        "results_source_record_id": 23021780
      },
      "publication": {
        "status": "published",
        "concept_doi": "10.5281/zenodo.23021779",
        "first_published_on": "2026-09-28",
        "last_version_on": "2026-10-14",
        "version_index": 2,
        "version_index_evidence": "Two publicly verified Zenodo version DOIs in the same concept lineage",
        "changes": [],
        "releases": [
          {
            "record_id": 23021780,
            "version_doi": "10.5281/zenodo.23021780",
            "published_on": "2026-09-28"
          },
          {
            "record_id": 23355587,
            "version_doi": "10.5281/zenodo.23355587",
            "published_on": "2026-10-14",
            "license": "cc-by-4.0",
            "pdf": {
              "filename": "P01_CF_V6_S8.pdf",
              "md5": "db0f6a1513c42d959641c001c9a9fabb",
              "size_bytes": 339634
            }
          }
        ],
        "source_path": "papers/01-sharp-universal-profile"
      }
    },
    "P02": {
      "identity": {
        "title": "The price of prescribed marginals in characteristic-function dependence: phase contact and complete mixability",
        "area": "transport",
        "topics": [
          "Fixed marginals",
          "Extremal probability",
          "Mixability"
        ],
        "keywords": [
          "Prescribed marginals",
          "Characteristic-function dependence",
          "Complete mixability",
          "Sharp coupling bounds",
          "Uniform and Gaussian marginals",
          "B-spline distributions",
          "Convex order",
          "Fourier log-concavity",
          "Extremal dependence",
          "Asymptotic coupling gap"
        ]
      },
      "science": {
        "summary": {
          "en": "Exact fixed-marginal results for uniform and spline laws; attainability via complete mixability and a strict Gaussian gap.",
          "ru": "Точные результаты для равномерных и сплайновых маргиналей; критерий через полную смешиваемость и зазор для гауссовских законов."
        },
        "abstract_html": "<p>For identical prescribed one-dimensional marginals <span class=\"math inline\">\\(F\\)</span>, we maximize the characteristic-function factorization defect over all couplings and signed frequency vectors. A convex-order and cosine-contact argument produces a scalar phase profile, but we carefully distinguish this upper profile <span class=\"math inline\">\\(\\kappa_d(F)\\)</span> from the actual coupling optimum <span class=\"math inline\">\\(K_d(F)\\)</span>. Under specified Fourier log-concavity, spectral-gap and anti-concentration assumptions, equality for all sufficiently large dimensions holds exactly when the absolute-value marginal <span class=\"math inline\">\\(|X|\\)</span> is completely mixable, i.e. admits a constant-sum coupling.</p>\n<p>We obtain finite-dimensional conclusions: the scalar profile is attained for uniform marginals in every <span class=\"math inline\">\\(d\\ge3\\)</span>; for Gaussian marginals it is strictly unattainable in every such dimension. For sums of three and four independent uniform variables (B-spline marginals), attainment begins exactly at dimensions four and five, respectively. We also quantify the asymptotic cost of fixing the marginal law: in the symmetric regular regime, <span class=\"math inline\">\\(C_d-K_d(F)=\\frac{\\pi^2}{2d}(\\operatorname{Var}(X)/(\\mathbb E|X|)^2-1)+o(d^{-1})\\)</span>. A median-based construction supplies a nonsymmetric lower bound. No universal equality between the scalar profile and the fixed-marginal optimum is claimed.</p>",
        "results": [
          {
            "en": "Uniform marginals attain the exact phase profile for d≥3; quadratic and cubic B-splines attain it from d=4 and d=5.",
            "ru": "Равномерные маргинали достигают профиля при d≥3, а квадратичные и кубические B-сплайны — при d≥4 и d≥5.",
            "evidence": "thm:models"
          },
          {
            "en": "Under stated Fourier hypotheses, equality is equivalent to complete mixability of |X|; Gaussian laws have a strict gap.",
            "ru": "При указанных условиях равенство эквивалентно полной смешиваемости |X|; гауссовские законы имеют строгий зазор.",
            "evidence": "thm:eventual"
          },
          {
            "en": "Without symmetry, a median construction gives K_d(F)≥2−π²Var(X)/(2d(E|X−a|)²)+o(1/d) for a median a.",
            "ru": "Без симметрии конструкция через медиану a даёт K_d(F)≥2−π²Var(X)/(2d(E|X−a|)²)+o(1/d).",
            "evidence": "thm:median"
          }
        ],
        "results_source_record_id": 23022043
      },
      "publication": {
        "status": "published",
        "concept_doi": "10.5281/zenodo.23022042",
        "first_published_on": "2026-09-28",
        "last_version_on": "2026-10-14",
        "version_index": 2,
        "version_index_evidence": "Two publicly verified Zenodo version DOIs in the same concept lineage",
        "changes": [],
        "releases": [
          {
            "record_id": 23022043,
            "version_doi": "10.5281/zenodo.23022043",
            "published_on": "2026-09-28"
          },
          {
            "record_id": 23355597,
            "version_doi": "10.5281/zenodo.23355597",
            "published_on": "2026-10-14",
            "license": "cc-by-4.0",
            "pdf": {
              "filename": "P02_CF_V6_S8.pdf",
              "md5": "d9d01bdf649060495bae883385df44e7",